{
  "schemaVersion": 1,
  "baseId": "level-0140",
  "difficulty": "medium",
  "levelRevision": 4,
  "levelSemanticHash": "55d9d6f0a8c97f381dd3d5650c94f11913fe04b42df2f1a8a371c51893cd7e01",
  "engineVersion": 1,
  "seedHex": "bb387df609fe8528",
  "initialStateHash": "aebcf2522eb9b981ea39519f63c9d31d7ae4c50043bf4b98ffddb4fae6d4fcbc",
  "steps": [
    {
      "swapBefore": false,
      "angleMilliDegrees": 550,
      "afterStateHash": "f792bf95818005adb8ccac11d530ac35dcf6f1609f539e8fd65ed64a8c2c012e",
      "metrics": {
        "target": {
          "r": 6,
          "c": 4
        },
        "bounces": 0,
        "matchedCells": 5,
        "droppedCells": 0,
        "rescuedStars": 0,
        "testedAimWindowMilliDegrees": 2000
      }
    },
    {
      "swapBefore": true,
      "angleMilliDegrees": -400,
      "afterStateHash": "67c2d0c4fb43548a395941748aacb1c4d43ef5377df42ed1e885b50833d174f9",
      "metrics": {
        "target": {
          "r": 4,
          "c": 4
        },
        "bounces": 0,
        "matchedCells": 7,
        "droppedCells": 0,
        "rescuedStars": 0,
        "testedAimWindowMilliDegrees": 2000
      }
    },
    {
      "swapBefore": true,
      "angleMilliDegrees": 0,
      "afterStateHash": "78b8c5fe23b99ba37789a56590ef867ba85bd5ec0d88ccec85dc3bd9fe00d43f",
      "metrics": {
        "target": {
          "r": 2,
          "c": 4
        },
        "bounces": 0,
        "matchedCells": 5,
        "droppedCells": 0,
        "rescuedStars": 0,
        "testedAimWindowMilliDegrees": 2000
      }
    },
    {
      "swapBefore": false,
      "angleMilliDegrees": -750,
      "afterStateHash": "98c94111536ca25490275d054598aa45db79a456fb9c71092bc18da6127c6b7f",
      "metrics": {
        "target": {
          "r": 0,
          "c": 4
        },
        "bounces": 0,
        "matchedCells": 4,
        "droppedCells": 3,
        "rescuedStars": 0,
        "testedAimWindowMilliDegrees": 2000
      }
    },
    {
      "swapBefore": false,
      "angleMilliDegrees": 3450,
      "afterStateHash": "43d511f6b76fe400ece624b7d0716479a1e326ea2d449897cdfb8e3ce20ecdd0",
      "metrics": {
        "target": {
          "r": 0,
          "c": 5
        },
        "bounces": 0,
        "matchedCells": 4,
        "droppedCells": 0,
        "rescuedStars": 0,
        "testedAimWindowMilliDegrees": 2000
      }
    },
    {
      "swapBefore": false,
      "angleMilliDegrees": 31800,
      "afterStateHash": "29e6550b270df32ae98db2d57f6a685d0c41c39b19e5a1415e5f14a8a7b38d3b",
      "metrics": {
        "target": {
          "r": 0,
          "c": 3
        },
        "bounces": 1,
        "matchedCells": 5,
        "droppedCells": 9,
        "rescuedStars": 0,
        "testedAimWindowMilliDegrees": 1080
      }
    }
  ],
  "finalStateHash": "29e6550b270df32ae98db2d57f6a685d0c41c39b19e5a1415e5f14a8a7b38d3b",
  "shotsUsed": 6,
  "score": 4905,
  "rescuedStars": 0,
  "outcome": "WON",
  "aimWindows": [
    {
      "stepIndex": 0,
      "lowerMilliDegrees": -450,
      "upperMilliDegrees": 1550,
      "testedWidthMilliDegrees": 2000
    },
    {
      "stepIndex": 1,
      "lowerMilliDegrees": -1400,
      "upperMilliDegrees": 600,
      "testedWidthMilliDegrees": 2000
    },
    {
      "stepIndex": 2,
      "lowerMilliDegrees": -1000,
      "upperMilliDegrees": 1000,
      "testedWidthMilliDegrees": 2000
    },
    {
      "stepIndex": 3,
      "lowerMilliDegrees": -1750,
      "upperMilliDegrees": 250,
      "testedWidthMilliDegrees": 2000
    },
    {
      "stepIndex": 4,
      "lowerMilliDegrees": 2450,
      "upperMilliDegrees": 4450,
      "testedWidthMilliDegrees": 2000
    },
    {
      "stepIndex": 5,
      "lowerMilliDegrees": 31264,
      "upperMilliDegrees": 32344,
      "testedWidthMilliDegrees": 1080
    }
  ]
}
