{
  "schemaVersion": 1,
  "baseId": "level-0146",
  "difficulty": "hard",
  "levelRevision": 4,
  "levelSemanticHash": "9fdd1d78d486b0dd3865c427e747ec6e5f8b3c0e8fe467204adea21b489a7dd2",
  "engineVersion": 1,
  "seedHex": "753e2b19c1045365",
  "initialStateHash": "7c6f326d05d9e4c6b05a501a7df8bcbe89a09b68cb967924fce9443b21e0f4d0",
  "steps": [
    {
      "swapBefore": false,
      "angleMilliDegrees": 0,
      "afterStateHash": "1d447df0aa2f6139bce261ea916397bcf0fac3dc45330d35318dd300d2dc00e0",
      "metrics": {
        "target": {
          "r": 6,
          "c": 4
        },
        "bounces": 0,
        "matchedCells": 4,
        "droppedCells": 0,
        "rescuedStars": 0,
        "testedAimWindowMilliDegrees": 1000
      }
    },
    {
      "swapBefore": true,
      "angleMilliDegrees": -1200,
      "afterStateHash": "0872bbe826f7ba272bc25fe7e32f99f297394fc6780c017291e14ac79be4eb58",
      "metrics": {
        "target": {
          "r": 6,
          "c": 4
        },
        "bounces": 0,
        "matchedCells": 0,
        "droppedCells": 0,
        "rescuedStars": 0,
        "testedAimWindowMilliDegrees": 1000
      }
    },
    {
      "swapBefore": true,
      "angleMilliDegrees": -2950,
      "afterStateHash": "888d495510233624c414306f07c20493aab833793ffdd26a9348073a6d379cf1",
      "metrics": {
        "target": {
          "r": 7,
          "c": 3
        },
        "bounces": 0,
        "matchedCells": 0,
        "droppedCells": 0,
        "rescuedStars": 0,
        "testedAimWindowMilliDegrees": 1000
      }
    },
    {
      "swapBefore": true,
      "angleMilliDegrees": -650,
      "afterStateHash": "ab10b45a50152a87987e4fa1b7fabea44ae08992ddc3a24975ff5f0e5799abe5",
      "metrics": {
        "target": {
          "r": 8,
          "c": 4
        },
        "bounces": 0,
        "matchedCells": 3,
        "droppedCells": 0,
        "rescuedStars": 0,
        "testedAimWindowMilliDegrees": 1000
      }
    },
    {
      "swapBefore": false,
      "angleMilliDegrees": -1200,
      "afterStateHash": "f438ccb4397fec2f7041a19740830ae6a730a49c910b6d0a6960d1c9bb5060cf",
      "metrics": {
        "target": {
          "r": 6,
          "c": 4
        },
        "bounces": 0,
        "matchedCells": 0,
        "droppedCells": 0,
        "rescuedStars": 0,
        "testedAimWindowMilliDegrees": 1000
      }
    },
    {
      "swapBefore": false,
      "angleMilliDegrees": -2950,
      "afterStateHash": "b796c6cf8a379f0b61632550476a9da84ad019c5b65d72f69d760d08d7343bcf",
      "metrics": {
        "target": {
          "r": 7,
          "c": 3
        },
        "bounces": 0,
        "matchedCells": 0,
        "droppedCells": 0,
        "rescuedStars": 0,
        "testedAimWindowMilliDegrees": 1000
      }
    },
    {
      "swapBefore": false,
      "angleMilliDegrees": -650,
      "afterStateHash": "730bf0fcf239c0f3549dcaf6c92e3acc3caefb2c3cf784748d4f5971ba2ec788",
      "metrics": {
        "target": {
          "r": 8,
          "c": 4
        },
        "bounces": 0,
        "matchedCells": 3,
        "droppedCells": 0,
        "rescuedStars": 0,
        "testedAimWindowMilliDegrees": 1000
      }
    },
    {
      "swapBefore": true,
      "angleMilliDegrees": -1200,
      "afterStateHash": "ee45a2d3a3706ca1f9fc7ad908e53e39f4917a03c9813be9a5ac5b29c7f269ec",
      "metrics": {
        "target": {
          "r": 6,
          "c": 4
        },
        "bounces": 0,
        "matchedCells": 5,
        "droppedCells": 0,
        "rescuedStars": 0,
        "testedAimWindowMilliDegrees": 1000
      }
    },
    {
      "swapBefore": false,
      "angleMilliDegrees": -350,
      "afterStateHash": "282ee0d55567a4b0b7e961dedd504507db8055adb92cb0fea72b180d8cf56035",
      "metrics": {
        "target": {
          "r": 2,
          "c": 4
        },
        "bounces": 0,
        "matchedCells": 5,
        "droppedCells": 8,
        "rescuedStars": 0,
        "testedAimWindowMilliDegrees": 849
      }
    },
    {
      "swapBefore": true,
      "angleMilliDegrees": -35500,
      "afterStateHash": "1a7e3ae02f8f76ce62c4b36304abf877d1b104365c5d42b2bc3d9c40c277bbe1",
      "metrics": {
        "target": {
          "r": 2,
          "c": 5
        },
        "bounces": 1,
        "matchedCells": 7,
        "droppedCells": 0,
        "rescuedStars": 0,
        "testedAimWindowMilliDegrees": 946
      }
    },
    {
      "swapBefore": true,
      "angleMilliDegrees": -35150,
      "afterStateHash": "b61979ee9b0b99cac21d623f7949b7c4387f724a0a72e4373a21ee646226283e",
      "metrics": {
        "target": {
          "r": 2,
          "c": 5
        },
        "bounces": 1,
        "matchedCells": 4,
        "droppedCells": 0,
        "rescuedStars": 0,
        "testedAimWindowMilliDegrees": 1000
      }
    },
    {
      "swapBefore": true,
      "angleMilliDegrees": 450,
      "afterStateHash": "8c5dcbd6f003b559f23e0dd5d3c1705fc3b036af1e19fb2f55a0e7d4d46f8681",
      "metrics": {
        "target": {
          "r": 6,
          "c": 4
        },
        "bounces": 0,
        "matchedCells": 5,
        "droppedCells": 0,
        "rescuedStars": 0,
        "testedAimWindowMilliDegrees": 950
      }
    },
    {
      "swapBefore": true,
      "angleMilliDegrees": -38800,
      "afterStateHash": "d62377fbced69d9181b013979c71d4c7799a1abe40476c8e9e5912bcada812a5",
      "metrics": {
        "target": {
          "r": 2,
          "c": 6
        },
        "bounces": 1,
        "matchedCells": 4,
        "droppedCells": 1,
        "rescuedStars": 0,
        "testedAimWindowMilliDegrees": 1000
      }
    },
    {
      "swapBefore": false,
      "angleMilliDegrees": -37400,
      "afterStateHash": "15e370745e2e23dc0d6d69375e9bff32f9ecbeee365633df7b92ce4112450fc1",
      "metrics": {
        "target": {
          "r": 0,
          "c": 7
        },
        "bounces": 1,
        "matchedCells": 4,
        "droppedCells": 3,
        "rescuedStars": 0,
        "testedAimWindowMilliDegrees": 1000
      }
    }
  ],
  "finalStateHash": "15e370745e2e23dc0d6d69375e9bff32f9ecbeee365633df7b92ce4112450fc1",
  "shotsUsed": 14,
  "score": 6000,
  "rescuedStars": 0,
  "outcome": "WON",
  "aimWindows": [
    {
      "stepIndex": 0,
      "lowerMilliDegrees": -500,
      "upperMilliDegrees": 500,
      "testedWidthMilliDegrees": 1000
    },
    {
      "stepIndex": 1,
      "lowerMilliDegrees": -1700,
      "upperMilliDegrees": -700,
      "testedWidthMilliDegrees": 1000
    },
    {
      "stepIndex": 2,
      "lowerMilliDegrees": -3450,
      "upperMilliDegrees": -2450,
      "testedWidthMilliDegrees": 1000
    },
    {
      "stepIndex": 3,
      "lowerMilliDegrees": -1150,
      "upperMilliDegrees": -150,
      "testedWidthMilliDegrees": 1000
    },
    {
      "stepIndex": 4,
      "lowerMilliDegrees": -1700,
      "upperMilliDegrees": -700,
      "testedWidthMilliDegrees": 1000
    },
    {
      "stepIndex": 5,
      "lowerMilliDegrees": -3450,
      "upperMilliDegrees": -2450,
      "testedWidthMilliDegrees": 1000
    },
    {
      "stepIndex": 6,
      "lowerMilliDegrees": -1150,
      "upperMilliDegrees": -150,
      "testedWidthMilliDegrees": 1000
    },
    {
      "stepIndex": 7,
      "lowerMilliDegrees": -1700,
      "upperMilliDegrees": -700,
      "testedWidthMilliDegrees": 1000
    },
    {
      "stepIndex": 8,
      "lowerMilliDegrees": -850,
      "upperMilliDegrees": -1,
      "testedWidthMilliDegrees": 849
    },
    {
      "stepIndex": 9,
      "lowerMilliDegrees": -35958,
      "upperMilliDegrees": -35012,
      "testedWidthMilliDegrees": 946
    },
    {
      "stepIndex": 10,
      "lowerMilliDegrees": -35650,
      "upperMilliDegrees": -34650,
      "testedWidthMilliDegrees": 1000
    },
    {
      "stepIndex": 11,
      "lowerMilliDegrees": 0,
      "upperMilliDegrees": 950,
      "testedWidthMilliDegrees": 950
    },
    {
      "stepIndex": 12,
      "lowerMilliDegrees": -39300,
      "upperMilliDegrees": -38300,
      "testedWidthMilliDegrees": 1000
    },
    {
      "stepIndex": 13,
      "lowerMilliDegrees": -37900,
      "upperMilliDegrees": -36900,
      "testedWidthMilliDegrees": 1000
    }
  ]
}
